{
  "$schema": "./components.schema.json",
  "catalog": "archpilot-components",
  "version": "1.0.0",
  "description": "Provider-neutral logical component catalogue (requirements-v2.md v2.1 section 4.1.1; design-v2 4.3.1 / D-03; red-team review B1). Role ids follow requirements v2.1. Included: every v2.1 Must and Should role, plus artifact_registry (v2.1 Could) because the Must wizard rule 'air-gap -> local artifact registry' (REQ-WIZ-006) needs it (review B1). Excluded until v1.1: the other v2.1 Could roles (service_mesh, batch_worker, integration_bus, time_series_db, data_warehouse, ci_cd, rack, power_ups, cooling, out_of_band_mgmt). Read by src/domain/graph/catalog.ts and backend/app/catalog.py. Nothing in this file may contain a provider or vendor term (NFR2-NEUT-001; token list: neutrality-tokens.json); vendor search terms belong in the per-target realisation catalogues (task T.1). Adding a role, variant or field is additive (minor version). Renaming or removing a role needs an alias entry plus a migration step (major version).",
  "limits": {
    "maxNestingDepth": 6
  },
  "layers": [
    { "id": "external_annotation", "order": 1, "label": { "en": "External and annotation", "vi": "Bên ngoài và chú thích" } },
    { "id": "edge", "order": 2, "label": { "en": "Edge and access", "vi": "Biên và truy cập" } },
    { "id": "network_containers", "order": 3, "label": { "en": "Network containers", "vi": "Vùng chứa mạng" } },
    { "id": "network", "order": 4, "label": { "en": "Network", "vi": "Mạng" } },
    { "id": "compute", "order": 5, "label": { "en": "Compute", "vi": "Tính toán" } },
    { "id": "application", "order": 6, "label": { "en": "Application", "vi": "Ứng dụng" } },
    { "id": "data", "order": 7, "label": { "en": "Data stores", "vi": "Kho dữ liệu" } },
    { "id": "storage", "order": 8, "label": { "en": "Storage", "vi": "Lưu trữ" } },
    { "id": "messaging", "order": 9, "label": { "en": "Messaging", "vi": "Truyền thông điệp" } },
    { "id": "security", "order": 10, "label": { "en": "Security and identity", "vi": "Bảo mật và định danh" } },
    { "id": "observability", "order": 11, "label": { "en": "Observability and operations", "vi": "Giám sát và vận hành" } }
  ],
  "attributes": [
    { "key": "replicas", "kind": "int", "label": { "en": "Replicas", "vi": "Số bản sao" }, "min": 1, "max": 1000, "required": true },
    { "key": "statefulness", "kind": "enum", "label": { "en": "Statefulness", "vi": "Trạng thái" }, "values": ["stateless", "stateful"], "required": true },
    { "key": "failureDomainLevel", "kind": "enum", "label": { "en": "Failure domain level", "vi": "Mức miền lỗi" }, "values": ["host", "rack", "zone", "site", "region"], "required": true },
    { "key": "failureDomainLabel", "kind": "text", "label": { "en": "Failure domain label", "vi": "Nhãn miền lỗi" }, "maxLength": 64 },
    { "key": "tier", "kind": "enum", "label": { "en": "Tier", "vi": "Tầng" }, "values": ["edge", "web", "app", "data", "mgmt"] },
    { "key": "criticality", "kind": "enum", "label": { "en": "Criticality", "vi": "Mức độ quan trọng" }, "values": ["low", "medium", "high"] },
    { "key": "dataClassification", "kind": "enum", "label": { "en": "Data classification", "vi": "Phân loại dữ liệu" }, "values": ["public", "internal", "confidential", "restricted"] },
    { "key": "sizeClass", "kind": "enum", "label": { "en": "Size class", "vi": "Cỡ" }, "values": ["XS", "S", "M", "L", "XL"] },
    { "key": "owner", "kind": "text", "label": { "en": "Owner", "vi": "Người phụ trách" }, "maxLength": 120 }
  ],
  "sizeClasses": {
    "XS": { "vcpu": 1, "memoryGiB": 2 },
    "S": { "vcpu": 2, "memoryGiB": 4 },
    "M": { "vcpu": 4, "memoryGiB": 16 },
    "L": { "vcpu": 8, "memoryGiB": 32 },
    "XL": { "vcpu": 16, "memoryGiB": 64 }
  },
  "edgeModes": [
    { "id": "connect", "label": { "en": "connects to", "vi": "kết nối tới" } },
    { "id": "read", "label": { "en": "reads", "vi": "đọc" } },
    { "id": "write", "label": { "en": "writes", "vi": "ghi" } },
    { "id": "read_write", "label": { "en": "reads and writes", "vi": "đọc và ghi" } },
    { "id": "send", "label": { "en": "sends to", "vi": "gửi tới" } },
    { "id": "consume", "label": { "en": "consumes from", "vi": "nhận từ" } },
    { "id": "send_consume", "label": { "en": "sends and consumes", "vi": "gửi và nhận" } },
    { "id": "publish", "label": { "en": "publishes to", "vi": "phát tới" } },
    { "id": "deliver", "label": { "en": "delivers to", "vi": "chuyển tới" } },
    { "id": "replicate", "label": { "en": "replicates to", "vi": "nhân bản tới" } }
  ],
  "roles": [
    {
      "id": "client", "layer": "external_annotation", "priority": "must",
      "label": { "en": "Client", "vi": "Máy khách" },
      "purpose": { "en": "People or devices that use the system: a browser, a mobile app, a partner system.", "vi": "Người hoặc thiết bị sử dụng hệ thống: trình duyệt, ứng dụng di động, hệ thống đối tác." },
      "synonyms": ["user", "end user", "browser", "mobile app", "device", "người dùng", "trình duyệt", "ứng dụng di động"],
      "container": false, "codeBearing": false,
      "defaultAttributes": { "statefulness": "stateless", "tier": "edge" },
      "accessModes": { "asSource": ["connect", "read", "write", "read_write", "send", "publish"], "asTarget": [] },
      "fields": [
        { "key": "channel", "kind": "enum", "label": { "en": "Channel", "vi": "Kênh" }, "values": ["web", "mobile", "partner_system", "device", "operator"], "default": "web" }
      ]
    },
    {
      "id": "external_service", "layer": "external_annotation", "priority": "must",
      "label": { "en": "External service", "vi": "Dịch vụ bên ngoài" },
      "purpose": { "en": "A system you call but do not run: a partner API, a software-as-a-service product, a payment provider.", "vi": "Hệ thống bạn gọi tới nhưng không vận hành: API đối tác, dịch vụ phần mềm thuê ngoài, cổng thanh toán." },
      "synonyms": ["external api", "third-party api", "partner api", "saas", "payment provider", "dịch vụ bên thứ ba", "api đối tác"],
      "container": false, "codeBearing": false,
      "defaultAttributes": { "statefulness": "stateless" },
      "accessModes": { "asSource": ["connect", "send", "publish", "deliver"], "asTarget": ["connect", "read", "write", "read_write", "send"] },
      "fields": [
        { "key": "protocol", "kind": "enum", "label": { "en": "Protocol", "vi": "Giao thức" }, "values": ["https", "grpc", "sftp", "smtp", "other"], "default": "https" }
      ]
    },
    {
      "id": "note", "layer": "external_annotation", "priority": "must",
      "label": { "en": "Note", "vi": "Ghi chú" },
      "purpose": { "en": "A sticky note on the canvas. Never produces code.", "vi": "Ghi chú dán trên canvas. Không bao giờ sinh mã." },
      "synonyms": ["comment", "sticky note", "ghi chú"],
      "container": false, "codeBearing": false,
      "defaultAttributes": {},
      "accessModes": { "asSource": [], "asTarget": [] },
      "fields": []
    },
    {
      "id": "shape", "layer": "external_annotation", "priority": "must",
      "label": { "en": "Shape", "vi": "Hình" },
      "purpose": { "en": "A rectangle or ellipse to group things visually. Never produces code.", "vi": "Hình chữ nhật hoặc elip để nhóm trực quan. Không bao giờ sinh mã." },
      "synonyms": ["rectangle", "ellipse", "box", "group", "hình chữ nhật", "khung"],
      "container": false, "codeBearing": false,
      "defaultAttributes": {},
      "accessModes": { "asSource": [], "asTarget": [] },
      "fields": []
    },
    {
      "id": "text", "layer": "external_annotation", "priority": "must",
      "label": { "en": "Text", "vi": "Văn bản" },
      "purpose": { "en": "A free text label on the canvas. Never produces code.", "vi": "Nhãn văn bản tự do trên canvas. Không bao giờ sinh mã." },
      "synonyms": ["label", "title", "caption", "nhãn", "tiêu đề"],
      "container": false, "codeBearing": false,
      "defaultAttributes": {},
      "accessModes": { "asSource": [], "asTarget": [] },
      "fields": []
    },
    {
      "id": "dns", "layer": "edge", "priority": "must",
      "label": { "en": "DNS", "vi": "DNS" },
      "purpose": { "en": "Name resolution, and traffic steering between sites.", "vi": "Phân giải tên miền và điều hướng lưu lượng giữa các địa điểm." },
      "synonyms": ["domain name system", "name server", "traffic steering", "global load balancing", "gslb", "phân giải tên miền", "tên miền"],
      "container": false, "codeBearing": true,
      "defaultAttributes": { "statefulness": "stateless", "tier": "edge" },
      "accessModes": { "asSource": [], "asTarget": ["connect"] },
      "fields": [
        { "key": "zoneName", "kind": "text", "label": { "en": "DNS zone", "vi": "Vùng DNS" }, "maxLength": 253 },
        { "key": "steering", "kind": "enum", "label": { "en": "Traffic steering", "vi": "Điều hướng lưu lượng" }, "values": ["none", "failover", "weighted", "latency", "geo"], "default": "none" }
      ]
    },
    {
      "id": "cdn", "layer": "edge", "priority": "must",
      "label": { "en": "Content delivery network", "vi": "Mạng phân phối nội dung" },
      "purpose": { "en": "Caches static and media content close to users.", "vi": "Lưu đệm nội dung tĩnh và đa phương tiện gần người dùng." },
      "synonyms": ["cdn", "edge cache", "content delivery", "static acceleration", "phân phối nội dung"],
      "container": false, "codeBearing": true,
      "defaultAttributes": { "statefulness": "stateless", "tier": "edge" },
      "accessModes": { "asSource": ["connect", "read"], "asTarget": ["connect", "read"] },
      "fields": [
        { "key": "cacheTtlSeconds", "kind": "int", "label": { "en": "Default cache TTL", "vi": "Thời gian lưu đệm mặc định" }, "min": 0, "max": 31536000, "default": 3600, "unit": "s" },
        { "key": "originProtocol", "kind": "enum", "label": { "en": "Origin protocol", "vi": "Giao thức tới nguồn" }, "values": ["http", "https"], "default": "https" }
      ]
    },
    {